{
  "schemaVersion": 1,
  "lessonId": "chemistry-concentration-solutions",
  "subject": "Chemistry",
  "title": "Concentration of Solutions",
  "blocks": [
    {"id":"orientation","type":"explanation","order":1,"learningGoal":"Explain concentration as solute per unit volume and select the correct calculation route.","tier":"Both","content":{"centralQuestion":"How much solute is present in each unit volume of solution?","objectives":["Calculate concentration, mass and volume in g/dm3","Convert cm3 to dm3","Calculate molar concentration","Use reacting volumes to find an unknown concentration"]}},
    {"id":"core-model","type":"explanation","order":2,"learningGoal":"Use concentration = mass / volume with consistent units.","tier":"Both","content":{"formula":"concentration (g/dm3) = mass (g) / volume (dm3)","conversion":"1 dm3 = 1000 cm3","guardrail":"Volume means final solution volume, not solvent volume before dissolving."}},
    {"id":"molar-model","type":"explanation","order":3,"learningGoal":"Relate molar concentration to amount, mass and relative formula mass.","tier":"Higher","content":{"formula":"concentration (mol/dm3) = amount (mol) / volume (dm3)","massLink":"moles = mass / Mr","conversion":"g/dm3 = mol/dm3 × Mr"}},
    {"id":"concentration-volume","type":"diagram","order":4,"learningGoal":"Explain the inverse relationship between volume and concentration at constant solute mass.","tier":"Both","content":{"representation":"premium realistic comparison of equal solute mass in 100 mL and 500 mL volumetric flasks","example":"5.0 g / 0.100 dm3 = 50 g/dm3; 5.0 g / 0.500 dm3 = 10 g/dm3","accessibleEquivalent":"Complete values and relationship are stated in the figure caption."}},
    {"id":"reacting-volume-route","type":"worked-example","order":5,"learningGoal":"Use known concentration and volume, a balanced-equation ratio and an unknown volume to calculate concentration.","tier":"Higher","content":{"route":["known moles = concentration × volume","apply coefficient ratio","unknown concentration = unknown moles / unknown volume"],"example":"25.0 cm3 of 0.200 mol/dm3 HCl contains 0.00500 mol and reacts 1:1 with 0.00500 mol NaOH."}},
    {"id":"worked-mass","type":"worked-example","order":6,"learningGoal":"Calculate mass concentration after converting volume.","tier":"Both","content":{"data":"12.0 g in 300 cm3","solution":"300 cm3 = 0.300 dm3; 12.0 / 0.300 = 40.0 g/dm3","commonError":"Dividing by 300 instead of 0.300."}},
    {"id":"worked-required-mass","type":"worked-example","order":7,"learningGoal":"Calculate the solute mass needed for a specified solution.","tier":"Both","content":{"data":"250 cm3 at 24 g/dm3","solution":"24 × 0.250 = 6.0 g"}},
    {"id":"worked-molar","type":"worked-example","order":8,"learningGoal":"Calculate molar concentration from mass, Mr and volume.","tier":"Higher","content":{"data":"5.85 g NaCl, Mr 58.5, in 500 cm3","solution":"5.85 / 58.5 = 0.100 mol; 0.100 / 0.500 = 0.200 mol/dm3"}},
    {"id":"assessment","type":"assessment","order":9,"learningGoal":"Demonstrate secure unit conversion, calculation and reacting-volume reasoning.","tier":"Both","content":{"diagnostic":[{"stem":"Convert 1 dm3 to cm3."},{"stem":"Select the equation for moles from mass."},{"stem":"Identify the solute."}],"guided":[{"stem":"Find g/dm3 for 10 g in 500 cm3."},{"stem":"Find mass in 200 cm3 at 35 g/dm3."},{"stem":"Find mol/dm3 for 0.060 mol in 150 cm3."}],"independent":[{"stem":"Calculate 8 g in 200 cm3."},{"stem":"Calculate mass in 0.300 dm3 at 20 g/dm3."},{"stem":"Predict the effect of dilution."},{"stem":"Calculate 0.50 mol in 250 cm3."},{"stem":"Convert 18 g/dm3 water to mol/dm3."}],"examPractice":[{"command":"Calculate","marks":3,"tier":"Both"},{"command":"Calculate","marks":3,"tier":"Both"},{"command":"Calculate","marks":4,"tier":"Higher"},{"command":"Calculate","marks":5,"tier":"Higher"}],"exit":[{"stem":"State the first step for 75 cm3."},{"stem":"Calculate mass when c = 12 g/dm3 and V = 0.50 dm3."}]}}
  ]
}
