{
  "schemaVersion": 1,
  "lessonId": "chemistry-acid-alkali-titration",
  "subject": "Chemistry",
  "title": "Acid–Alkali Titration: Method and Calculations",
  "blocks": [
    {"id":"orientation","type":"explanation","order":1,"learningGoal":"Explain how titration finds an accurate reacting volume and distinguish the practical and calculation pathways.","tier":"Both","content":{"centralQuestion":"How can we measure the exact volume needed for neutralisation?","objectives":["Set up and use a pipette, burette and conical flask safely","Identify a sharp indicator endpoint","select concordant titres and calculate a mean","Use titration results to calculate an unknown concentration"]}},
    {"id":"core-method","type":"explanation","order":2,"learningGoal":"Carry out a valid acid–alkali titration and obtain repeatable titres.","tier":"Both","content":{"sequence":["rinse and fill the burette with titrant, then remove the funnel","transfer a fixed aliquot with a volumetric pipette and pipette filler","add two or three drops of a suitable indicator","perform a rough titration, then repeat accurately","near the endpoint add titrant dropwise while swirling","record initial and final readings and calculate each titre"],"safety":"Wear eye protection; use a pipette filler; rinse splashes with plenty of water."}},
    {"id":"endpoint-figure","type":"diagram","order":3,"learningGoal":"Recognise a scientifically plausible titration arrangement and a faint permanent endpoint.","tier":"Both","content":{"representation":"premium realistic burette, clamp, conical flask and white-tile setup","accessibleEquivalent":"The caption and adjacent method list state every assessed apparatus and endpoint detail."}},
    {"id":"titre-table","type":"explanation","order":4,"learningGoal":"Select concordant accurate titres and calculate their mean without using the rough result.","tier":"Both","content":{"rough":"24.10 cm3","accurate":["23.70 cm3","23.65 cm3","23.65 cm3"],"mean":"(23.70 + 23.65 + 23.65) / 3 = 23.67 cm3","guardrail":"Use only concordant accurate titres; apply the tolerance stated in the question or centre method."}},
    {"id":"worked-technique","type":"worked-example","order":5,"learningGoal":"Explain why key titration decisions improve accuracy.","tier":"Both","content":{"decisions":["remove the funnel so extra drops cannot change the burette reading","use a white tile to see the endpoint clearly","wash flask walls with distilled water without changing the reacting moles","read the bottom of the meniscus at eye level to avoid parallax"]}},
    {"id":"worked-calculation","type":"worked-example","order":6,"learningGoal":"Use concentration, volume and equation ratio to calculate an unknown concentration.","tier":"Higher","content":{"equation":"HCl + NaOH -> NaCl + H2O","known":"23.60 cm3 of 0.100 mol/dm3 HCl neutralises 25.00 cm3 NaOH","route":["n(HCl) = 0.100 x 0.02360 = 0.002360 mol","1:1, so n(NaOH) = 0.002360 mol","c(NaOH) = 0.002360 / 0.02500 = 0.0944 mol/dm3"]}},
    {"id":"assessment","type":"assessment","order":7,"learningGoal":"Demonstrate secure method, data handling and titration-calculation reasoning.","tier":"Both","content":{"diagnostic":[{"stem":"Identify the apparatus that delivers a fixed aliquot."},{"stem":"Calculate a titre from initial and final burette readings."},{"stem":"Explain the purpose of a suitable indicator."}],"guided":[{"stem":"Order the main titration steps."},{"stem":"Select concordant titres and calculate a mean."},{"stem":"Calculate an unknown concentration for a 1:1 reaction."}],"independent":[{"stem":"Identify why the funnel is removed."},{"stem":"Explain why distilled water may wash down the flask walls."},{"stem":"Identify and correct a parallax error."},{"stem":"Calculate a 1:1 unknown concentration."},{"stem":"Calculate an unknown concentration using a 2:1 ratio."}],"examPractice":[{"command":"Describe","marks":4,"tier":"Both"},{"command":"Evaluate","marks":3,"tier":"Both"},{"command":"Calculate","marks":5,"tier":"Higher"},{"command":"Calculate","marks":6,"tier":"Higher"}],"exit":[{"stem":"State which titres should be included in a mean."},{"stem":"State the five-stage calculation route."}]}}
  ]
}
