{
  "schemaVersion": 1,
  "lessonId": "chemistry-preparing-soluble-salts",
  "subject": "Chemistry",
  "title": "Preparing a Pure, Dry Soluble Salt",
  "blocks": [
    {"id":"orientation","type":"explanation","order":1,"learningGoal":"Select a suitable acid and insoluble solid, then explain the route to pure, dry salt crystals.","tier":"Both","content":{"centralQuestion":"How can we prepare pure, dry crystals of a soluble salt?","objectives":["Choose reactants for a named salt","Use the warm, add-to-excess, filter, concentrate and crystallise method","Explain why excess solid and filtration are needed","Evaluate choices that affect purity and yield"]}},
    {"id":"core-method","type":"explanation","order":2,"learningGoal":"Carry out the preparation safely and in the correct sequence.","tier":"Both","content":{"sequence":["warm dilute sulfuric acid gently","add copper(II) oxide in small portions while stirring","continue until some black solid remains","filter off the excess solid","heat the blue filtrate gently to concentrate it","cool to crystallise, then filter, rinse and dry"],"safety":"Wear eye protection; use a hot-water bath or electric heater; do not boil or heat to dryness."}},
    {"id":"crystallisation-figure","type":"diagram","order":3,"learningGoal":"Recognise a safe, scientifically plausible crystallisation setup.","tier":"Both","content":{"representation":"realistic evaporating basin containing blue copper sulfate solution in a hot-water bath on an electric hot plate","accessibleEquivalent":"The caption and adjacent method state the apparatus, heating control and purpose in assessed text."}},
    {"id":"reaction-model","type":"explanation","order":4,"learningGoal":"Connect the practical method to the neutralisation reaction and salt naming.","tier":"Both","content":{"equation":"H2SO4 + CuO -> CuSO4 + H2O","acidRules":["hydrochloric acid makes chlorides","sulfuric acid makes sulfates","nitric acid makes nitrates"]}},
    {"id":"worked-method","type":"worked-example","order":5,"learningGoal":"Explain how each separation step improves purity and recovery.","tier":"Both","content":{"decisions":["excess insoluble solid ensures all acid is neutralised","filtration removes unreacted copper(II) oxide","gentle evaporation concentrates rather than dries the solution","cooling forms crystals","a little cold distilled water removes solution with minimal crystal loss"]}},
    {"id":"worked-selection","type":"worked-example","order":6,"learningGoal":"Choose an appropriate salt-preparation route from reactant solubility.","tier":"Both","content":{"insolubleRoute":"Use excess solid and filtration for an insoluble base or carbonate.","solubleRoute":"Use titration when both reactants are soluble because excess cannot be filtered off."}},
    {"id":"assessment","type":"assessment","order":7,"learningGoal":"Demonstrate secure method, chemistry and evaluation reasoning.","tier":"Both","content":{"diagnostic":[{"stem":"Identify the acid used to make a sulfate."},{"stem":"Identify the purpose of filtration."},{"stem":"Identify the best endpoint for evaporation."}],"guided":[{"stem":"Order the salt-preparation method."},{"stem":"Explain why copper(II) oxide is added to excess."},{"stem":"Choose a method for a salt from two soluble reactants."}],"independent":[{"stem":"Name the salt formed from nitric acid and magnesium oxide."},{"stem":"Explain why some copper(II) oxide should remain."},{"stem":"Identify what passes through the filter paper."},{"stem":"Explain why the solution is not heated to dryness."},{"stem":"Predict the effect of washing crystals with much warm water."}],"examPractice":[{"command":"Describe","marks":6,"tier":"Both"},{"command":"Explain","marks":4,"tier":"Both"},{"command":"Evaluate","marks":4,"tier":"Both"},{"command":"Apply","marks":4,"tier":"Both"}],"exit":[{"stem":"State the five-stage method route."},{"stem":"State when titration is used instead."}]}}
  ]
}
